{
  "version": 1,
  "meta": {
    "name": "Issue Triage",
    "description": "Reference agent line: new issue → Claude agent → labels + one summary comment."
  },
  "nodes": [
    {
      "id": "t1",
      "type": "trigger.issue_opened",
      "position": { "x": 40, "y": 140 },
      "config": {}
    },
    {
      "id": "a1",
      "type": "agent.claude",
      "position": { "x": 340, "y": 140 },
      "config": {
        "promptRef": ".factory/prompts/triage.md",
        "model": "claude-sonnet-5-5",
        "maxTurns": 8
      }
    },
    {
      "id": "s1",
      "type": "sink.label",
      "position": { "x": 660, "y": 60 },
      "config": { "labels": "" }
    },
    {
      "id": "s2",
      "type": "sink.comment",
      "position": { "x": 660, "y": 220 },
      "config": { "instruction": "summarizes the triage decision in 3 lines and links any duplicates" }
    }
  ],
  "edges": [
    { "id": "e1", "from": { "node": "t1", "port": "out" }, "to": { "node": "a1", "port": "in" } },
    { "id": "e2", "from": { "node": "a1", "port": "out" }, "to": { "node": "s1", "port": "in" } },
    { "id": "e3", "from": { "node": "a1", "port": "out" }, "to": { "node": "s2", "port": "in" } }
  ]
}
